{
  "version": 2,
  "status": "PROPOSED_SOURCE_INVENTORY_FULL_181_PAGE_REVIEW_OR2",
  "sourceDecision": {
    "primaryTier0Source": "SRC-MH2537-PERIOD-FOUNDATION",
    "primaryEditionPdfSha256": "28D74F5D7258A00EFA4967186B15ED97174E173AB12BD4DF9FBED66BD3EA890E",
    "scannedPages": 308,
    "ocrPages": 308,
    "allPagesHashed": true,
    "visualCrossCheckPages": [
      52,
      53,
      54,
      55,
      56,
      57,
      58,
      59,
      60,
      61,
      62,
      63,
      64,
      65,
      66,
      67,
      68,
      69,
      70,
      71,
      72,
      73,
      74,
      75,
      89,
      90,
      91,
      92,
      93,
      94,
      95,
      96,
      97,
      98,
      99,
      100,
      101,
      102,
      103,
      104,
      105,
      106,
      107,
      108,
      109,
      110,
      111,
      122,
      123,
      124,
      125,
      126,
      127,
      128,
      129,
      130,
      131,
      132,
      133,
      134,
      135,
      136,
      137,
      138,
      139,
      140,
      141,
      142,
      143,
      144,
      145,
      146,
      147,
      158,
      159,
      160,
      161,
      162,
      163,
      164,
      165,
      166,
      167,
      168,
      169,
      170,
      171,
      172,
      173,
      174,
      175,
      176,
      177,
      178,
      179,
      188,
      189,
      190,
      191,
      192,
      193,
      194,
      195,
      196,
      197,
      198,
      199,
      200,
      201,
      202,
      203,
      204,
      205,
      206,
      207,
      208,
      209,
      210,
      211,
      212,
      213,
      214,
      215,
      216,
      217,
      228,
      229,
      230,
      231,
      232,
      233,
      234,
      235,
      236,
      237,
      238,
      239,
      240,
      241,
      242,
      243,
      244,
      245,
      246,
      247,
      248,
      249,
      250,
      251,
      252,
      253,
      263,
      264,
      265,
      266,
      267,
      268,
      269,
      270,
      271,
      272,
      273,
      274,
      275,
      276,
      277,
      278,
      279,
      280,
      281,
      282,
      283,
      284,
      285,
      286,
      287,
      288,
      289,
      290,
      291,
      292
    ],
    "tier1AuthorityUsed": false,
    "tier2AuthorityUsed": false,
    "searchSnippetsUsedAsEvidence": false,
    "aiSummariesUsedAsEvidence": false,
    "contextStartPagesVisuallyChecked": 49,
    "fullContextRangeVisualCrossCheckClaimed": true
  },
  "counts": {
    "sourceRecords": 54,
    "contextRecords": 49,
    "pageInventory": 308,
    "pagesWithTopicHits": 287,
    "pagesVisuallyChecked": 181,
    "contextStartPagesVisuallyChecked": 49
  },
  "records": [
    {
      "sourceId": "SRC-MH2537-PERIOD-FOUNDATION",
      "title": "ตำราดูและแก้ดวงชะตาด้วยตนเอง หลักมหาภูต ฉบับสมบูรณ์",
      "authorOrOrganization": "ส. หยกฟ้า (ผู้รวบรวม)",
      "publisher": "สำนักพิมพ์ดวงแก้ว",
      "editionYear": "พ.ศ. 2537",
      "isbn": "974-89176-7-3",
      "localSourceIdentity": "mahabhut-2537-book.pdf#sha256=28D74F5D7258A00EFA4967186B15ED97174E173AB12BD4DF9FBED66BD3EA890E",
      "page": "17",
      "pageRange": "17-18",
      "section": "ความรู้เรื่องดวงขึ้นและดวงตก และกำลังอายุที่ดาวเคราะห์เสวย",
      "ocrSpanSha256": "67A747FC3A72774661103E0D31ABD250BDDF6BBC047C5FE01AA146C6D1379AFC",
      "paraphrase": "นิยามเรือนฝ่ายขึ้นและฝ่ายตก ระยะของแต่ละดาว และช่วงเปลี่ยนผ่านที่ตำราให้ระวังเป็นพิเศษ",
      "sourceTier": 0,
      "reliability": "PRIMARY_WORKING_EDITION_PAGE_IMAGE_AND_OCR_CROSS_CHECKED",
      "limitations": "ใช้ได้เพียงระดับช่วงอายุของดาว ไม่รองรับเดือน วัน หรือเหตุการณ์เฉพาะ",
      "accessedAt": "2026-08-31"
    },
    {
      "sourceId": "SRC-MH2537-PLANET-SYSTEM",
      "title": "ตำราดูและแก้ดวงชะตาด้วยตนเอง หลักมหาภูต ฉบับสมบูรณ์",
      "authorOrOrganization": "ส. หยกฟ้า (ผู้รวบรวม)",
      "publisher": "สำนักพิมพ์ดวงแก้ว",
      "editionYear": "พ.ศ. 2537",
      "isbn": "974-89176-7-3",
      "localSourceIdentity": "mahabhut-2537-book.pdf#sha256=28D74F5D7258A00EFA4967186B15ED97174E173AB12BD4DF9FBED66BD3EA890E",
      "page": "29",
      "pageRange": "29-37",
      "section": "ความหมายพิสดารของดาวเคราะห์ทั้งแปด",
      "ocrSpanSha256": "4D09CD82AB2882BA379591F8FBD14C572F31526C6B596EA1087100A90D45B2B8",
      "paraphrase": "อธิบายขอบเขตบุคคล สิ่งของ สถานที่ งาน ความสัมพันธ์ และสุขภาวะที่ผูกกับดาวแต่ละดวง พร้อมหลักเหตุและผล",
      "sourceTier": 0,
      "reliability": "PRIMARY_WORKING_EDITION_PAGE_IMAGE_AND_OCR_CROSS_CHECKED",
      "limitations": "รายการโรคเป็นข้อความตามตำราเก่า ห้ามนำไปวินิจฉัยหรือระบุโรคใน reader copy",
      "accessedAt": "2026-08-31"
    },
    {
      "sourceId": "SRC-MH2537-TAKSA-SYSTEM",
      "title": "ตำราดูและแก้ดวงชะตาด้วยตนเอง หลักมหาภูต ฉบับสมบูรณ์",
      "authorOrOrganization": "ส. หยกฟ้า (ผู้รวบรวม)",
      "publisher": "สำนักพิมพ์ดวงแก้ว",
      "editionYear": "พ.ศ. 2537",
      "isbn": "974-89176-7-3",
      "localSourceIdentity": "mahabhut-2537-book.pdf#sha256=28D74F5D7258A00EFA4967186B15ED97174E173AB12BD4DF9FBED66BD3EA890E",
      "page": "37",
      "pageRange": "37-39",
      "section": "มหาทักษาและความหมายของแต่ละภูมิ",
      "ocrSpanSha256": "1E3319A892BE3BCC882A48A333616EC7D15E0EAAFC4BB88BFAC95D093FA5238F",
      "paraphrase": "ระบุการหมุนบทบาทตามวันเกิดและนิยามบริวาร อายุ เดช ศรี มูละ อุตสาหะ มนตรี และกาฬกิณี",
      "sourceTier": 0,
      "reliability": "PRIMARY_WORKING_EDITION_PAGE_IMAGE_AND_OCR_CROSS_CHECKED",
      "limitations": "ต้องรู้วันทางโหราศาสตร์จากเวลาเกิดจริง ห้ามแทนเวลาไม่ทราบด้วยเวลาเที่ยง",
      "accessedAt": "2026-08-31"
    },
    {
      "sourceId": "SRC-MH2537-HOUSE-WEAK",
      "title": "ตำราดูและแก้ดวงชะตาด้วยตนเอง หลักมหาภูต ฉบับสมบูรณ์",
      "authorOrOrganization": "ส. หยกฟ้า (ผู้รวบรวม)",
      "publisher": "สำนักพิมพ์ดวงแก้ว",
      "editionYear": "พ.ศ. 2537",
      "isbn": "974-89176-7-3",
      "localSourceIdentity": "mahabhut-2537-book.pdf#sha256=28D74F5D7258A00EFA4967186B15ED97174E173AB12BD4DF9FBED66BD3EA890E",
      "page": "40",
      "pageRange": "40",
      "section": "หลักการทำนายเมื่อดาวและทักษาอยู่ภังคะ มรณะ หรือปูติ",
      "ocrSpanSha256": "A398C86E35259E1B5C5585CC779F31741207BDB56AE01061E89D0E5E3A7660EF",
      "paraphrase": "สิ่งที่สัมพันธ์กับดาวและทักษามีแนวโน้มอ่อนกำลัง ช้า ไม่ครบ หรือพึ่งพาได้ยาก โดยกาฬกิณีกลับขั้วเพราะแรงอุปสรรคอ่อนลง",
      "sourceTier": 0,
      "reliability": "PRIMARY_WORKING_EDITION_PAGE_IMAGE_AND_OCR_CROSS_CHECKED",
      "limitations": "รองรับเพียงทิศทางกว้าง ห้ามขยายเป็นเหตุการณ์เฉพาะ จำนวนเงิน โรค หรือกำหนดเวลา",
      "accessedAt": "2026-08-31"
    },
    {
      "sourceId": "SRC-MH2537-HOUSE-STRONG",
      "title": "ตำราดูและแก้ดวงชะตาด้วยตนเอง หลักมหาภูต ฉบับสมบูรณ์",
      "authorOrOrganization": "ส. หยกฟ้า (ผู้รวบรวม)",
      "publisher": "สำนักพิมพ์ดวงแก้ว",
      "editionYear": "พ.ศ. 2537",
      "isbn": "974-89176-7-3",
      "localSourceIdentity": "mahabhut-2537-book.pdf#sha256=28D74F5D7258A00EFA4967186B15ED97174E173AB12BD4DF9FBED66BD3EA890E",
      "page": "41",
      "pageRange": "41",
      "section": "หลักการทำนายเมื่อดาวและทักษาอยู่ธงชัย ขุมทรัพย์ ราชา หรืออธิบดี",
      "ocrSpanSha256": "7D7D434B468DC8B4B19A751F15B9EFA4FA095FBC3FE2BBB07C52F07ED11B697D",
      "paraphrase": "สิ่งที่สัมพันธ์กับดาวและทักษามีแนวโน้มมั่นคง ครบ พึ่งพาได้ และให้แรงสนับสนุน โดยกาฬกิณีกลับขั้วเพราะแรงอุปสรรคเข้มแข็งขึ้น",
      "sourceTier": 0,
      "reliability": "PRIMARY_WORKING_EDITION_PAGE_IMAGE_AND_OCR_CROSS_CHECKED",
      "limitations": "รองรับเพียงทิศทางกว้าง ห้ามขยายเป็นเหตุการณ์เฉพาะ จำนวนเงิน โรค หรือกำหนดเวลา",
      "accessedAt": "2026-08-31"
    },
    {
      "sourceId": "SRC-MH2537-CONTEXT-REM1-SUNDAY",
      "title": "ตำราดูและแก้ดวงชะตาด้วยตนเอง หลักมหาภูต ฉบับสมบูรณ์",
      "authorOrOrganization": "ส. หยกฟ้า (ผู้รวบรวม)",
      "publisher": "สำนักพิมพ์ดวงแก้ว",
      "editionYear": "พ.ศ. 2537",
      "isbn": "974-89176-7-3",
      "localSourceIdentity": "mahabhut-2537-book.pdf#sha256=28D74F5D7258A00EFA4967186B15ED97174E173AB12BD4DF9FBED66BD3EA890E",
      "page": "52",
      "pageRange": "52-55",
      "section": "ดวงกำพร้า คนเกิดวันอาทิตย์",
      "ocrSpanSha256": "0D72DB801BBAB93891C834AAC4B1D85E52ED4AAE7CA4A1C4783817FE56055B28",
      "paraphrase": "ตารางตำแหน่งดาว ทักษา เรือน และช่วงอายุครบแปดช่วงสำหรับ mahabhut2537.rem1.sunday; ข้อความเหตุการณ์ใช้ได้เฉพาะเมื่อมี source-direct map แยกต่างหาก",
      "sourceTier": 0,
      "reliability": "FULL_CONTEXT_RANGE_IMAGE_AND_OCR_REVIEWED_OR2",
      "limitations": "Placement facts are not promoted to event authority; period authority comes only from the 392-row extraction ledger.",
      "accessedAt": "2026-08-31",
      "verification": {
        "contextId": "mahabhut2537.rem1.sunday",
        "pagesExpected": [
          52,
          53,
          54,
          55
        ],
        "pagesOcrChecked": [
          52,
          53,
          54,
          55
        ],
        "pagesVisuallyChecked": [
          52,
          53,
          54,
          55
        ],
        "unresolvedTextCount": 0
      }
    },
    {
      "sourceId": "SRC-MH2537-CONTEXT-REM1-MONDAY",
      "title": "ตำราดูและแก้ดวงชะตาด้วยตนเอง หลักมหาภูต ฉบับสมบูรณ์",
      "authorOrOrganization": "ส. หยกฟ้า (ผู้รวบรวม)",
      "publisher": "สำนักพิมพ์ดวงแก้ว",
      "editionYear": "พ.ศ. 2537",
      "isbn": "974-89176-7-3",
      "localSourceIdentity": "mahabhut-2537-book.pdf#sha256=28D74F5D7258A00EFA4967186B15ED97174E173AB12BD4DF9FBED66BD3EA890E",
      "page": "56",
      "pageRange": "56-59",
      "section": "ดวงกำพร้า คนเกิดวันจันทร์",
      "ocrSpanSha256": "FBC4BBFE8F21DA94286881FF62977AB6DD23C5259551F5ABF762A878965DF1A5",
      "paraphrase": "ตารางตำแหน่งดาว ทักษา เรือน และช่วงอายุครบแปดช่วงสำหรับ mahabhut2537.rem1.monday; ข้อความเหตุการณ์ใช้ได้เฉพาะเมื่อมี source-direct map แยกต่างหาก",
      "sourceTier": 0,